name,description,price,teacher
Pemograman Sisi Server,Mempelajari teknologi backend menggunakan Node.js Django dan REST API untuk membangun aplikasi web modern,50000,2
Pemograman Sisi Klien,Mempelajari HTML CSS JavaScript React dan Vue.js untuk pengembangan frontend yang interaktif,30000,2
Penambangan Data,Teknik data mining machine learning dan analisis data menggunakan Python pandas dan scikit-learn,70000,3
Kecerdasan Buatan,Pembelajaran mendalam tentang AI neural networks deep learning dan implementasi model AI,90000,3
Sistem Terdistribusi,Arsitektur microservices cloud computing Docker Kubernetes dan sistem terdistribusi modern,40000,2
Kriptografi,Keamanan informasi enkripsi dekripsi blockchain dan aplikasi kriptografi dalam sistem informasi,80000,3